{"claim_id":"claim-001","corpus_version":"ifc2x3-property-records/0.2","model_id":"sha256:f61ff5cf8e1cc88da6944d6bcd3e2e7da5ff27dd3288a8781908018cb8240cd6","operation_id":"restore-column-1","operation_type":"add_column","property_phrase":"load bearing","query_id":"property-query:repair-c6d67d090cc34e6f8db102f29f122aa2:restore-column-1:claim-001","raw_unit":null,"raw_value":true,"raw_value_kind":"boolean","request_id":"request-017ec4f6862d5f3d","run_id":"repair-c6d67d090cc34e6f8db102f29f122aa2","schema_version":"text2ifc/ifc-property-resolution-query/0.2","scope":"occurrence_direct","target_ifc_class":"IfcColumn"}
