{"claim_id":"claim-001","corpus_version":"ifc2x3-property-records/0.2","model_id":"sha256:f61ff5cf8e1cc88da6944d6bcd3e2e7da5ff27dd3288a8781908018cb8240cd6","operation_id":"set-window-property-1","operation_type":"set_occurrence_properties","property_phrase":"外窗","query_id":"property-query:repair-dfddefc5afde41b7878505aa10d62519:set-window-property-1:claim-001","raw_unit":null,"raw_value":true,"raw_value_kind":"boolean","request_id":"request-ebc0fc54b9ae5c00","run_id":"repair-dfddefc5afde41b7878505aa10d62519","schema_version":"text2ifc/ifc-property-resolution-query/0.2","scope":"occurrence_direct","target_ifc_class":"IfcWindow"}
