{"claim_id":"claim-001","corpus_version":"ifc2x3-property-records/0.2","model_id":"sha256:f61ff5cf8e1cc88da6944d6bcd3e2e7da5ff27dd3288a8781908018cb8240cd6","operation_id":"set-window-fire-rating-1","operation_type":"set_occurrence_properties","property_phrase":"防火等级","query_id":"property-query:repair-d6ef32287e0440858edca8fa8a4078be:set-window-fire-rating-1:claim-001","raw_unit":null,"raw_value":"EI60","raw_value_kind":"string","request_id":"request-00bb6ee2ce21cdea","run_id":"repair-d6ef32287e0440858edca8fa8a4078be","schema_version":"text2ifc/ifc-property-resolution-query/0.2","scope":"occurrence_direct","target_ifc_class":"IfcWindow"}
